{
  "$schema": "../board_schema.json",
  "x_dim": 12,
  "y_dim": 12,
  "display_name": "Pushy",
  "walls": {
    "horizontal_walls": [
      [null,null,null,null,null,{"hi":{"registers": [3]}},null,null,null,null,null,null,null],
      [null,null,null,null,null,null,null,null,null,null,null,null,null],
      [null,null,null,null,null,null,null,null,null,null,null,null,null],
      [null,null,{"lo":{"registers": [1,3,5]}},null,null,null,{"lo":{"registers": [1,3,5]}},null,null,null,{"lo":"laser"},null,null],
      [null,null,null,null,null,null,null,{},null,null,null,null,null],
      [null,null,null,null,null,null,null,null,null,null,null,null,null],
      [null,null,null,null,null,{"hi":{"registers": [2,4]}},null,null,null,{"hi":{"registers": [2,4]}},null,null,null],
      [null,null,null,null,null,null,null,null,{},null,null,null,null],
      [null,null,null,null,{},null,null,null,null,null,null,null,null],
      [null,null,{"lo":{"registers": [2,4]}},null,null,null,{"lo":{"registers": [2,4]}},null,{"lo":{"registers": [1,3,5]}},null,{"lo":{"registers": [2,4]}},null,null],
      [null,null,null,null,null,null,null,null,null,null,null,null,null],
      [null,null,null,null,null,null,null,null,null,null,null,null,null]
    ],
    "vertical_walls": [
      [null,null,null,null,null,null,null,null,null,null,null,null],
      [null,null,null,null,null,null,null,null,null,null,null,null],
      [null,{"lo":{"registers": [2,4]}},null,{"hi":"laser"},null,{"lo":{"registers": [2,4]}},null,{"hi":{"registers": [1,3,5]}},null,{"lo":{"registers": [2,4]}},null,null],
      [null,null,null,null,null,null,null,null,null,null,null,null],
      [null,null,null,null,null,null,null,null,null,null,null,null],
      [{},null,{},null,{},null,null,null,{},null,{},null],
      [null,null,null,null,null,null,null,null,null,null,null,null],
      [null,null,null,null,null,null,null,null,null,null,null,null],
      [null,{"hi":{"registers": [1,3,5]}},null,{},null,null,{},null,null,{"hi":{"registers": [1,3,5]}},null,null],
      [null,null,null,null,null,null,null,null,null,null,null,null],
      [null,null,null,null,null,null,null,null,null,null,null,null],
      [null,null,null,null,{},null,null,null,null,null,null,null],
      [null,null,null,null,null,null,null,null,null,null,null,null]
    ]
  },
  "spaces": [
    [
      {},
      {"type": "conv_L","orientation": "N"},
      {"type": "conv_R","orientation": "E"},
      {},
      {},
      {},
      {"type": "pit"},
      {},
      {"type": "conv_F","orientation": "E"},
      {},
      {},
      {}
    ],[
      {},
      {},
      {"type": "conv_L","orientation": "N"},
      {"type": "conv_F","orientation": "N","cover":"scrambler"},
      {"type": "conv_R","orientation": "E"},
      {"type": "gear_R"},
      {"type": "conv_F","orientation": "S"},
      {"type": "conv_F","orientation": "S","cover":"scrambler"},
      {"type": "conv_R","orientation": "S"},
      {},
      {"type": "conv_F","orientation": "S"},
      {"type": "conv_F","orientation": "S"}
    ],[
      {},
      {},
      {},
      {},
      {"type": "conv_F","orientation": "E"},
      {"type": "pit"},
      {"type": "gear_L"},
      {},
      {},
      {},
      {},
      {}
    ],[
      {"type": "conv_R","orientation": "E"},
      {},
      {"type": "battery"},
      {"type": "conv_L","orientation": "E"},
      {"type": "conv_R","orientation": "S"},
      {"type": "conv_F","orientation": "W"},
      {},
      {"type": "conv_L","orientation": "E"},
      {"type": "conv_F","orientation": "S"},
      {},
      {},
      {"type": "gear_R"}
    ],[
      {"type": "conv_L","orientation": "N"},
      {"type": "conv_F","orientation": "N","cover":"scrambler"},
      {"type": "conv_F","orientation": "N"},
      {"type": "conv_RF","orientation": "E"},
      {},
      {"type": "conv_F","orientation": "W","cover":{"registers": [2,5]}},
      {},
      {"type": "conv_F","orientation": "E"},
      {},
      {"type": "battery"},
      {},
      {}
    ],[
      {"type": "conv_F","orientation": "S"},
      {"type": "conv_L","orientation": "S"},
      {"type": "conv_L","orientation": "E"},
      {"type": "conv_R","orientation": "S"},
      {"type": "conv_R","orientation": "N"},
      {"type": "conv_L","orientation": "W"},
      {"type": "conv_L","orientation": "E"},
      {"type": "conv_RF","orientation": "S"},
      {"type": "conv_L","orientation": "S"},
      {},
      {"type": "conv_L","orientation": "E"},
      {"type": "conv_F","orientation": "S"}
    ],[
      {},
      {"type": "conv_F","orientation": "W","cover":"scrambler"},
      {"type": "conv_F","orientation": "E","cover":{"registers": [2,5]}},
      {},
      {"type": "conv_F","orientation": "W","cover":"scrambler"},
      {},
      {"type": "conv_F","orientation": "E"},
      {},
      {"type": "conv_F","orientation": "W","cover":"scrambler"},
      {},
      {"type": "conv_F","orientation": "E","cover":{"registers": [1,3]}},
      {}
    ],[
      {},
      {"type": "conv_R","orientation": "W"},
      {"type": "conv_R","orientation": "S"},
      {},
      {"type": "conv_RF","orientation": "W"},
      {"type": "conv_F","orientation": "S","cover":{"registers": [3,4]}},
      {"type": "conv_R","orientation": "S"},
      {"type": "pit"},
      {"type": "conv_R","orientation": "W"},
      {"type": "conv_F","orientation": "S","cover":{"registers": [2,4]}},
      {"type": "conv_R","orientation": "S"},
      {}
    ],[
      {},
      {"type": "gear_L"},
      {"type": "conv2_L","orientation": "S"},
      {},
      {"type": "conv_F","orientation": "W"},
      {},
      {},
      {},
      {"type": "battery"},
      {},
      {"type": "conv_L","orientation": "E"},
      {"type": "conv_F","orientation": "S"}
    ],[
      {"type": "conv2_F","orientation": "E"},
      {},
      {"type": "conv2_F","orientation": "W"},
      {"type": "battery"},
      {"type": "conv_F","orientation": "W"},
      {},
      {"type": "pit"},
      {},
      {"type": "conv2_F","orientation": "E"},
      {},
      {"type": "conv_F","orientation": "E"},
      {}
    ],[
      {"type": "conv2_F","orientation": "E"},
      {"cover":"scrambler"},
      {"type": "conv2_R","orientation": "W"},
      {"type": "conv2_L","orientation": "S"},
      {},
      {},
      {},
      {"type": "conv2_RF","orientation": "W"},
      {"type": "conv2_R","orientation": "S"},
      {"type": "conv_R","orientation": "W"},
      {"type": "conv_R","orientation": "S"},
      {}
    ],[
      {"type": "conv2_R","orientation": "S"},
      {},
      {},
      {"type": "conv2_F","orientation": "W"},
      {},
      {},
      {},
      {"type": "conv2_R","orientation": "W"},
      {"type": "conv2_F","orientation": "S"},
      {},
      {},
      {}
    ]
  ]
}