{
    "$schema": "../board_schema.json",
    "display_name": "In & Out",
    "x_dim": 12,
    "y_dim": 12,
    "walls": {
        "horizontal_walls": [
            [null,null,null,null,null,null,null,null,null,null,null,null,null],
            [null,null,null,null,null,null,null,null,null,null,null,null,null],
            [null,null,null,null,null,null,null,null,null,null,null,null,null],
            [null,null,null,null,null,null,{},null,null,null,null,null,null],
            [null,null,null,null,null,null,null,null,null,null,null,null,null],
            [null,null,null,null,{},null,null,null,null,null,null,null,null],
            [null,null,null,null,null,null,null,null,{},null,null,null,null],
            [null,null,null,null,null,null,null,null,null,null,null,null,null],
            [null,null,null,null,null,null,{},null,null,null,null,null,null],
            [null,null,null,null,null,null,null,null,null,null,null,null,null],
            [null,null,null,null,null,null,null,null,null,null,null,null,null],
            [null,null,null,null,null,null,null,null,null,null,null,null,null]
        ],
        "vertical_walls": [
            [null,null,null,null,null,null,null,null,null,null,null,null],
            [null,null,null,null,null,null,null,null,null,null,null,null],
            [null,null,null,null,null,null,null,null,null,null,null,null],
            [null,null,null,null,null,null,null,null,null,null,null,null],
            [null,null,null,null,null,null,{},null,null,null,null,null],
            [null,null,null,null,null,null,null,null,null,null,null,null],
            [null,null,null,{},null,null,null,null,{},null,null,null],
            [null,null,null,null,null,null,null,null,null,null,null,null],
            [null,null,null,null,null,{},null,null,null,null,null,null],
            [null,null,null,null,null,null,null,null,null,null,null,null],
            [null,null,null,null,null,null,null,null,null,null,null,null],
            [null,null,null,null,null,null,null,null,null,null,null,null],
            [null,null,null,null,null,null,null,null,null,null,null,null]
        ]
    },
    "spaces": [
        [
            {},
            {"type": "conv2_F","orientation": "E"},
            {},
            {"type": "conv2_F","orientation": "W"},
            {},
            {"type": "conv_R","orientation": "N"},
            {"type": "conv_L","orientation": "W"},
            {},
            {},
            {},
            {},
            {}
        ],[
            {},
            {"type": "conv2_F","orientation": "E"},
            {},
            {"type": "conv2_F","orientation": "W"},
            {},
            {"type": "conv_F","orientation": "W"},
            {"type": "conv2_L","orientation": "E"},
            {"type": "conv2_F","orientation": "S"},
            {"type": "conv2_F","orientation": "S"},
            {"type": "conv2_F","orientation": "S"},
            {"type": "conv2_F","orientation": "S"},
            {"type": "conv2_F","orientation": "S"}
        ],[
            {},
            {"type": "conv2_F","orientation": "E"},
            {},
            {"type": "conv2_F","orientation": "W"},
            {"type": "conv_R","orientation": "N"},
            {"type": "conv_L","orientation": "W"},
            {"type": "conv2_F","orientation": "E"},
            {},
            {"type": "battery"},
            {},
            {},
            {}
        ],[
            {},
            {"type": "conv2_F","orientation": "E"},
            {"type": "battery"},
            {"type": "conv2_F","orientation": "W"},
            {"type": "conv_R","orientation": "W"},
            {"type": "conv_L","orientation": "S"},
            {"type": "conv2_L","orientation": "N"},
            {"type": "conv2_F","orientation": "N"},
            {"type": "conv2_F","orientation": "N"},
            {"type": "conv2_F","orientation": "N"},
            {"type": "conv2_F","orientation": "N"},
            {"type": "conv2_F","orientation": "N"}
        ],[
            {},
            {"type": "conv2_F","orientation": "E"},
            {},
            {"type": "conv2_F","orientation": "W"},
            {},
            {"type": "conv_R","orientation": "W"},
            {"type": "conv_L","orientation": "S"},
            {},
            {},
            {},
            {},
            {}
        ],[
            {"type": "conv_L","orientation": "S"},
            {"type": "conv2_L","orientation": "N"},
            {"type": "conv2_F","orientation": "N"},
            {"type": "conv2_L","orientation": "W"},
            {},
            {},
            {"type": "conv_R","orientation": "W"},
            {"type": "conv_F","orientation": "S"},
            {"type": "conv_F","orientation": "S"},
            {"type": "conv_F","orientation": "S"},
            {"type": "conv_F","orientation": "S"},
            {"type": "conv_F","orientation": "S"}
        ],[
            {"type": "conv_R","orientation": "W"},
            {"type": "conv_F","orientation": "S"},
            {"type": "conv_F","orientation": "S"},
            {"type": "conv_L","orientation": "S"},
            {},
            {},
            {},
            {},
            {"type": "conv2_L","orientation": "E"},
            {"type": "conv2_F","orientation": "S"},
            {"type": "conv2_L","orientation": "S"},
            {}
        ],[
            {},
            {},
            {},
            {"type": "conv_R","orientation": "W"},
            {"type": "conv_F","orientation": "S"},
            {"type": "conv_F","orientation": "S"},
            {"type": "conv_L","orientation": "S"},
            {},
            {"type": "conv2_F","orientation": "E"},
            {},
            {"type": "conv2_F","orientation": "E"},
            {}
        ],[
            {"type": "conv2_F","orientation": "S"},
            {"type": "conv2_F","orientation": "S"},
            {"type": "conv2_F","orientation": "S"},
            {"type": "conv2_F","orientation": "S"},
            {"type": "conv2_F","orientation": "S"},
            {"type": "conv2_L","orientation": "S"},
            {"type": "conv_R","orientation": "W"},
            {"type": "conv_L","orientation": "S"},
            {"type": "conv2_F","orientation": "E"},
            {"type": "battery"},
            {"type": "conv2_F","orientation": "W"},
            {}
        ],[
            {},
            {},
            {},
            {"type": "battery"},
            {},
            {"type": "conv2_F","orientation": "W"},
            {},
            {"type": "conv_F","orientation": "W"},
            {"type": "conv2_F","orientation": "E"},
            {},
            {"type": "conv2_F","orientation": "E"},
            {}
        ],[
            {"type": "conv2_F","orientation": "N"},
            {"type": "conv2_F","orientation": "N"},
            {"type": "conv2_F","orientation": "N"},
            {"type": "conv2_F","orientation": "N"},
            {"type": "conv2_F","orientation": "N"},
            {"type": "conv2_L","orientation": "W"},
            {},
            {"type": "conv_F","orientation": "W"},
            {"type": "conv2_F","orientation": "E"},
            {},
            {"type": "conv2_F","orientation": "E"},
            {}
        ],[
            {},
            {},
            {},
            {},
            {},
            {},
            {"type": "conv_R","orientation": "N"},
            {"type": "conv_L","orientation": "W"},
            {"type": "conv2_F","orientation": "E"},
            {},
            {"type": "conv2_F","orientation": "E"},
            {}
        ]
    ]
}