{
  "$schema": "../board_schema.json",
  "display_name": "Laser Maze",
  "x_dim": 12,
  "y_dim": 12,
  "walls": {
    "horizontal_walls": [
      [null,{},null,null,null,null,null,null,null,null,{},null,null],
      [null,null,{"hi": "laser"},{},null,null,null,null,null,null,null,null,null],
      [{"hi": "laser"},null,null,null,null,null,null,null,null,null,{},null,{"lo": "laser2"}],
      [null,null,{"hi": "laser"},{},{},{},{},null,null,{},null,null,null],
      [{},null,null,null,null,null,{"hi": "laser2"},{"hi": "laser"},{"hi": "laser2"},null,null,null,{}],
      [null,null,null,null,null,{},null,null,{},null,{},null,null],
      [null,null,null,{},null,null,null,null,null,{"lo": "laser"},null,null,null],
      [{},null,null,null,{},null,{},null,null,null,{"hi": "laser3"},null,{}],
      [null,null,null,{"hi": "laser"},null,{},null,null,{},{"lo": "laser2"},null,null,null],
      [{},null,null,null,null,null,null,null,{},null,null,{},{}],
      [null,null,null,null,null,null,null,null,null,null,null,null,null],
      [null,null,null,null,null,null,null,null,null,{},null,null,null]
    ],
    "vertical_walls": [
      [null,null,{},null,{},null,null,{"hi": "laser2"},null,{},null,null],
      [{},null,null,null,null,null,null,null,null,null,null,{}],
      [null,{},null,null,null,{"hi": "laser"},null,{},null,{},{"lo": {"registers": [2,4]}},null],
      [null,{},null,null,null,null,null,{},null,null,null,null],
      [null,null,null,null,null,null,null,null,{},null,null,null],
      [null,null,null,{},null,null,null,null,{},null,{},null],
      [null,null,null,{"lo":"laser2"},null,null,{},null,null,null,null,null],
      [null,null,null,null,{},null,null,{},null,null,null,null],
      [null,null,null,null,null,null,{},null,null,null,{"hi":"laser2"},null],
      [{"lo":{"registers": [5]}},null,{},null,null,{"hi":"laser2"},null,null,null,null,{},null],
      [null,{"hi":{"registers": [2,4]}},null,null,{},{},null,null,null,{"hi":"laser2"},null,null],
      [null,null,null,null,null,null,null,{"hi":"laser3"},null,null,null,null],
      [null,null,{},null,{"lo":"laser"},null,null,{},null,{},null,null]
    ]
  },
  "spaces": [
    [
      {},
      {"type": "conv_F","orientation": "E"},
      {},
      {},
      {},
      {"type": "conv_F","orientation": "E"},
      {"type": "conv_F","orientation": "W"},
      {},
      {},
      {},
      {"type": "conv_F","orientation": "W"},
      {}
    ],[
      {"type": "conv_F","orientation": "S"},
      {"type": "conv_R","orientation": "E"},
      {},
      {"type": "pit"},
      {"type": "conv_F","orientation": "S"},
      {"type": "conv_R","orientation": "E"},
      {"type": "conv_R","orientation": "S"},
      {"type": "conv_F","orientation": "S"},
      {"type": "conv_F","orientation": "S"},
      {"type": "conv_F","orientation": "S"},
      {"type": "conv_F","orientation": "S"},
      {"type": "conv_F","orientation": "S"}
    ],[
      {},
      {},
      {},
      {},
      {},
      {},
      {},
      {},
      {},
      {},
      {},
      {}
      ],[
      {},
      {},
      {},
      {},
      {},
      {},
      {},
      {},
      {},
      {},
      {},
      {"type": "battery"}
    ],[
      {"type": "pit"},
      {"type": "pit"},
      {},
      {},
      {},
      {},
      {},
      {},
      {},
      {},
      {},
      {}
    ],[
      {"type": "conv_F","orientation": "S"},
      {"type": "conv_F","orientation": "S"},
      {},
      {},
      {},
      {},
      {},
      {"type": "battery"},
      {},
      {},
      {"type": "pit"},
      {"type": "conv_F","orientation": "S"}
    ],[
      {"type": "conv_F","orientation": "N"},
      {"type": "conv_F","orientation": "N"},
      {"type": "conv_R","orientation": "N"},
      {"type": "conv_R","orientation": "W"},
      {"type": "conv_F","orientation": "N"},
      {"type": "conv_F","orientation": "N"},
      {"type": "conv_F","orientation": "N"},
      {"type": "conv_F","orientation": "N"},
      {"type": "conv_R","orientation": "N"},
      {"type": "conv_R","orientation": "W"},
      {"type": "conv_F","orientation": "N"},
      {"type": "conv_RF","orientation": "N"}
    ],[
      {"type": "pit"},
      {"type": "pit"},
      {"type": "conv_L","orientation": "N"},
      {"type": "conv_L","orientation": "W"},
      {"type": "battery"},
      {},
      {},
      {},
      {"type": "conv_L","orientation": "N"},
      {"type": "conv_L","orientation": "W"},
      {},
      {"type": "conv_F","orientation": "W"}
    ],[
      {},
      {},
      {},
      {},
      {},
      {},
      {},
      {},
      {},
      {},
      {},
      {"type": "conv_RF","orientation": "W"}
    ],[
      {},
      {},
      {},
      {"type": "pit"},
      {},
      {},
      {},
      {"type": "pit"},
      {},
      {},
      {},
      {"type": "conv_F","orientation": "W"}
    ],[
      {"type": "conv_F","orientation": "N"},
      {"type": "conv_F","orientation": "N"},
      {"type": "conv_F","orientation": "N"},
      {"type": "conv_F","orientation": "N"},
      {"type": "conv_F","orientation": "N"},
      {"type": "conv_R","orientation": "N"},
      {"type": "conv_R","orientation": "W"},
      {"type": "conv_L","orientation": "W"},
      {},
      {},
      {"type": "conv_R","orientation": "W"},
      {"type": "conv_L","orientation": "W"}
    ],[
      {"type": "battery"},
      {"type": "conv_F","orientation": "E"},
      {},
      {},
      {},
      {"type": "conv_F","orientation": "E"},
      {"type": "conv_F","orientation": "W"},
      {},
      {},
      {},
      {"type": "conv_F","orientation": "W"},
      {"type": "pit"}
    ]
  ]
}